{
  "version": "1.0.0",
  "evaluatedAt": "2026-10-01T11:42:30.491Z",
  "inputSource": "access-graph\\examples\\procurement-agent.access.json",
  "windowDays": 90,
  "telemetryCoveragePercent": 100,
  "agents": [
    {
      "agentIdentityId": "procurement-agent-prod",
      "blueprintId": "procurement-agents-blueprint",
      "resolvedPermissions": [
        {
          "resourceApp": "Microsoft Graph",
          "permission": "Sites.Read.All",
          "permissionType": "delegated",
          "grantTypes": [
            "inherited"
          ],
          "status": "effective",
          "reach": {
            "theoretical": "tenant-wide",
            "configured": "tenant-wide",
            "observedResourceIds": [
              "procurement-site"
            ],
            "observedCount": 1,
            "utilization": "observed-used"
          },
          "confidence": "high"
        },
        {
          "resourceApp": "Microsoft Graph",
          "permission": "Files.Read.All",
          "permissionType": "delegated",
          "grantTypes": [
            "inherited"
          ],
          "status": "effective",
          "reach": {
            "theoretical": "tenant-wide",
            "configured": "tenant-wide",
            "observedResourceIds": [],
            "observedCount": 0,
            "utilization": "carried-not-proven-used"
          },
          "confidence": "high"
        },
        {
          "resourceApp": "Microsoft Graph",
          "permission": "Mail.Read",
          "permissionType": "delegated",
          "grantTypes": [
            "inherited"
          ],
          "status": "effective",
          "reach": {
            "theoretical": "tenant-wide",
            "configured": "tenant-wide",
            "observedResourceIds": [],
            "observedCount": 0,
            "utilization": "carried-not-proven-used"
          },
          "confidence": "high"
        },
        {
          "resourceApp": "Microsoft Graph",
          "permission": "Sites.ReadWrite.All",
          "permissionType": "application",
          "grantTypes": [
            "direct"
          ],
          "status": "effective",
          "reach": {
            "theoretical": "tenant-wide",
            "configured": "tenant-wide",
            "observedResourceIds": [
              "finance-site"
            ],
            "observedCount": 1,
            "utilization": "observed-used"
          },
          "confidence": "high"
        }
      ],
      "sensitiveExposure": [
        {
          "resourceId": "procurement-site",
          "classification": "internal",
          "access": "readWrite",
          "viaPermission": "Sites.ReadWrite.All"
        },
        {
          "resourceId": "finance-site",
          "classification": "confidential",
          "access": "readWrite",
          "viaPermission": "Sites.ReadWrite.All"
        },
        {
          "resourceId": "legal-site",
          "classification": "highlyConfidential",
          "access": "readWrite",
          "viaPermission": "Sites.ReadWrite.All"
        },
        {
          "resourceId": "executive-onedrive",
          "classification": "highlyConfidential",
          "access": "read",
          "viaPermission": "Files.Read.All"
        },
        {
          "resourceId": "shared-mailbox",
          "classification": "internal",
          "access": "read",
          "viaPermission": "Mail.Read"
        },
        {
          "resourceId": "finance-forecast-index",
          "classification": "highlyConfidential",
          "access": "none"
        }
      ]
    },
    {
      "agentIdentityId": "procurement-agent-dev",
      "blueprintId": "procurement-agents-blueprint",
      "resolvedPermissions": [
        {
          "resourceApp": "Microsoft Graph",
          "permission": "Sites.Read.All",
          "permissionType": "delegated",
          "grantTypes": [
            "inherited"
          ],
          "status": "effective",
          "reach": {
            "theoretical": "tenant-wide",
            "configured": "tenant-wide",
            "observedResourceIds": [],
            "observedCount": 0,
            "utilization": "not-observed"
          },
          "confidence": "high"
        },
        {
          "resourceApp": "Microsoft Graph",
          "permission": "Files.Read.All",
          "permissionType": "delegated",
          "grantTypes": [
            "inherited"
          ],
          "status": "effective",
          "reach": {
            "theoretical": "tenant-wide",
            "configured": "tenant-wide",
            "observedResourceIds": [],
            "observedCount": 0,
            "utilization": "not-observed"
          },
          "confidence": "high"
        },
        {
          "resourceApp": "Microsoft Graph",
          "permission": "Mail.Read",
          "permissionType": "delegated",
          "grantTypes": [
            "inherited"
          ],
          "status": "effective",
          "reach": {
            "theoretical": "tenant-wide",
            "configured": "tenant-wide",
            "observedResourceIds": [],
            "observedCount": 0,
            "utilization": "not-observed"
          },
          "confidence": "high"
        }
      ],
      "sensitiveExposure": [
        {
          "resourceId": "procurement-site",
          "classification": "internal",
          "access": "read",
          "viaPermission": "Sites.Read.All"
        },
        {
          "resourceId": "finance-site",
          "classification": "confidential",
          "access": "read",
          "viaPermission": "Sites.Read.All"
        },
        {
          "resourceId": "legal-site",
          "classification": "highlyConfidential",
          "access": "read",
          "viaPermission": "Sites.Read.All"
        },
        {
          "resourceId": "executive-onedrive",
          "classification": "highlyConfidential",
          "access": "read",
          "viaPermission": "Files.Read.All"
        },
        {
          "resourceId": "shared-mailbox",
          "classification": "internal",
          "access": "read",
          "viaPermission": "Mail.Read"
        },
        {
          "resourceId": "finance-forecast-index",
          "classification": "highlyConfidential",
          "access": "none"
        }
      ]
    },
    {
      "agentIdentityId": "procurement-agent-eu",
      "blueprintId": "procurement-agents-blueprint",
      "resolvedPermissions": [
        {
          "resourceApp": "Microsoft Graph",
          "permission": "Sites.Read.All",
          "permissionType": "delegated",
          "grantTypes": [
            "inherited"
          ],
          "status": "effective",
          "reach": {
            "theoretical": "tenant-wide",
            "configured": "tenant-wide",
            "observedResourceIds": [],
            "observedCount": 0,
            "utilization": "not-observed"
          },
          "confidence": "high"
        },
        {
          "resourceApp": "Microsoft Graph",
          "permission": "Files.Read.All",
          "permissionType": "delegated",
          "grantTypes": [
            "inherited"
          ],
          "status": "effective",
          "reach": {
            "theoretical": "tenant-wide",
            "configured": "tenant-wide",
            "observedResourceIds": [],
            "observedCount": 0,
            "utilization": "not-observed"
          },
          "confidence": "high"
        },
        {
          "resourceApp": "Microsoft Graph",
          "permission": "Mail.Read",
          "permissionType": "delegated",
          "grantTypes": [
            "inherited"
          ],
          "status": "effective",
          "reach": {
            "theoretical": "tenant-wide",
            "configured": "tenant-wide",
            "observedResourceIds": [],
            "observedCount": 0,
            "utilization": "not-observed"
          },
          "confidence": "high"
        },
        {
          "resourceApp": "SharePoint Online",
          "permission": "Sites.Selected",
          "permissionType": "application",
          "grantTypes": [
            "direct"
          ],
          "status": "incomplete-resource-grant",
          "reach": {
            "theoretical": "tenant-wide (pending per-resource grants)",
            "configured": "0 resources granted yet",
            "observedResourceIds": [],
            "observedCount": 0,
            "utilization": "not-observed"
          },
          "confidence": "high"
        }
      ],
      "sensitiveExposure": [
        {
          "resourceId": "procurement-site",
          "classification": "internal",
          "access": "read",
          "viaPermission": "Sites.Read.All"
        },
        {
          "resourceId": "finance-site",
          "classification": "confidential",
          "access": "read",
          "viaPermission": "Sites.Read.All"
        },
        {
          "resourceId": "legal-site",
          "classification": "highlyConfidential",
          "access": "read",
          "viaPermission": "Sites.Read.All"
        },
        {
          "resourceId": "executive-onedrive",
          "classification": "highlyConfidential",
          "access": "read",
          "viaPermission": "Files.Read.All"
        },
        {
          "resourceId": "shared-mailbox",
          "classification": "internal",
          "access": "read",
          "viaPermission": "Mail.Read"
        },
        {
          "resourceId": "finance-forecast-index",
          "classification": "highlyConfidential",
          "access": "none"
        }
      ]
    },
    {
      "agentIdentityId": "procurement-agent-reporting",
      "blueprintId": "procurement-agents-blueprint",
      "resolvedPermissions": [
        {
          "resourceApp": "Microsoft Graph",
          "permission": "Sites.Read.All",
          "permissionType": "delegated",
          "grantTypes": [
            "inherited"